{
  "$schema": "../../../schemas/item.schema.json",
  "id": "capybara",
  "status": "mock",
  "methodologyVersion": "0.2",
  "lastReviewed": "2026-09-25",
  "category": "nature",
  "presence": [
    {
      "place": "VE",
      "level": "widespread",
      "sources": ["fictional-rodent-survey"]
    },
    {
      "place": "CO",
      "level": "widespread",
      "sources": ["fictional-rodent-survey"]
    },
    {
      "place": "PY",
      "level": "widespread",
      "sources": ["fictional-rodent-survey"]
    },
    {
      "place": "BO",
      "level": "widespread",
      "sources": ["fictional-rodent-survey"]
    },
    {
      "place": "GF",
      "level": "widespread",
      "sources": ["fictional-rodent-survey"]
    },
    {
      "place": "AR",
      "level": "regional",
      "sources": ["fictional-rodent-survey"]
    },
    {
      "place": "US",
      "level": ["absent", "marginal"],
      "sources": ["fictional-escape-report"]
    }
  ],
  "intensity": {
    "value": {
      "min": 1,
      "max": 2
    },
    "sources": ["fictional-rodent-survey"]
  },
  "awareness": {
    "value": 4,
    "sources": [],
    "editorial": true
  },
  "sources": [
    {
      "id": "fictional-rodent-survey",
      "type": "academic",
      "title": "Censo Imaginário de Roedores Sul-Americanos",
      "publisher": "Instituto de Pesquisas Imaginárias",
      "url": "https://example.org/rodent-survey",
      "published": "2024",
      "accessed": "2026-09-25",
      "language": "pt"
    },
    {
      "id": "fictional-escape-report",
      "type": "news",
      "title": "Capybara Seen Near Retention Pond, Allegedly",
      "publisher": "The Example Gazette",
      "url": "https://example.org/escape-report",
      "accessed": "2026-09-25",
      "language": "en"
    }
  ],
  "related": ["caramel-mutt"],
  "image": {
    "file": "cover.webp",
    "credit": {
      "author": "Índice Jabuticaba (imagem fictícia)",
      "license": "CC0-1.0"
    }
  }
}
