{
  "$schema": "../../../schemas/item.schema.json",
  "id": "court-ordered-debt-queue",
  "status": "mock",
  "methodologyVersion": "0.2",
  "lastReviewed": "2026-09-25",
  "category": "economy",
  "since": 1934,
  "presence": [],
  "intensity": {
    "value": 4,
    "sources": [],
    "editorial": true
  },
  "awareness": {
    "value": 0,
    "sources": [],
    "editorial": true
  },
  "sources": [
    {
      "id": "fictional-decree",
      "type": "government",
      "title": "Decreto Fictício nº 0.000, de 1º de abril de 2020",
      "publisher": "Diário Oficial Imaginário",
      "url": "https://example.org/fictional-decree",
      "published": "2020-04-01",
      "accessed": "2026-09-25",
      "language": "pt"
    }
  ],
  "related": ["electoral-court"],
  "image": {
    "file": "cover.webp",
    "credit": {
      "author": "Índice Jabuticaba (imagem fictícia)",
      "license": "CC0-1.0"
    }
  }
}
