{
  "$schema": "../../../schemas/item.schema.json",
  "id": "three-pin-plug",
  "status": "mock",
  "methodologyVersion": "0.2",
  "lastReviewed": "2026-09-25",
  "category": "home",
  "since": 2011,
  "presence": [
    {
      "place": "ZA",
      "level": "regional",
      "sources": ["fictional-decree"]
    }
  ],
  "intensity": {
    "value": {
      "min": 3,
      "max": 4
    },
    "sources": ["fictional-decree"]
  },
  "awareness": {
    "value": 2,
    "sources": [],
    "editorial": true
  },
  "sources": [
    {
      "id": "fictional-decree",
      "type": "government",
      "title": "Decreto Fictício nº 0.000, de 1º de abril de 2020",
      "publisher": "Diário Oficial Imaginário",
      "url": "https://example.org/fictional-decree",
      "published": "2020-04-01",
      "accessed": "2026-09-25",
      "language": "pt"
    }
  ],
  "image": {
    "file": "cover.webp",
    "credit": {
      "author": "Índice Jabuticaba (imagem fictícia)",
      "license": "CC0-1.0"
    }
  }
}
