{
  "$schema": "../../../schemas/item.schema.json",
  "id": "electric-shower",
  "status": "mock",
  "methodologyVersion": "0.2",
  "lastReviewed": "2026-09-25",
  "category": "home",
  "since": {
    "min": 1940,
    "max": 1950
  },
  "presence": [
    {
      "place": "PE",
      "level": "widespread",
      "sources": ["fictional-association"]
    },
    {
      "place": "CO",
      "level": "widespread",
      "sources": ["fictional-association"]
    },
    {
      "place": "EC",
      "level": "widespread",
      "sources": ["fictional-association"]
    },
    {
      "place": "BO",
      "level": "widespread",
      "sources": ["fictional-association"]
    },
    {
      "place": "GT",
      "level": "widespread",
      "sources": ["fictional-association"]
    },
    {
      "place": "HN",
      "level": "regional",
      "sources": ["fictional-association"]
    },
    {
      "place": "NI",
      "level": "regional",
      "sources": ["fictional-association"]
    },
    {
      "place": "SV",
      "level": "regional",
      "sources": ["fictional-association"]
    },
    {
      "place": "MX",
      "level": "regional",
      "sources": ["fictional-association"]
    },
    {
      "place": "CR",
      "level": "regional",
      "sources": ["fictional-association"]
    }
  ],
  "intensity": {
    "value": 3,
    "ratio": 8,
    "sources": ["fictional-census"]
  },
  "awareness": {
    "value": {
      "min": 0,
      "max": 1
    },
    "sources": [],
    "editorial": true
  },
  "sources": [
    {
      "id": "fictional-association",
      "type": "organization",
      "title": "Relatório Anual da Associação Hipotética",
      "publisher": "Associação Brasileira de Coisas Hipotéticas",
      "url": "https://example.org/fictional-association",
      "published": "2025-11",
      "accessed": "2026-09-25",
      "language": "pt"
    },
    {
      "id": "fictional-census",
      "type": "dataset",
      "title": "Censo Imaginário de Coisas Brasileiras 2025",
      "publisher": "Instituto Brasileiro de Geografia Imaginária",
      "url": "https://example.org/fictional-census",
      "published": "2025",
      "accessed": "2026-09-25",
      "language": "pt"
    }
  ]
}
