{
  "$schema": "../../../schemas/item.schema.json",
  "id": "caipirinha",
  "status": "mock",
  "methodologyVersion": "0.2",
  "lastReviewed": "2026-09-25",
  "category": "food",
  "presence": [
    {
      "place": "AD",
      "level": "regional",
      "exported": true,
      "sources": ["fictional-gazette"]
    },
    {
      "place": "AE",
      "level": "regional",
      "exported": true,
      "sources": ["fictional-gazette"]
    },
    {
      "place": "AF",
      "level": "regional",
      "exported": true,
      "sources": ["fictional-gazette"]
    },
    {
      "place": "AG",
      "level": "regional",
      "exported": true,
      "sources": ["fictional-gazette"]
    },
    {
      "place": "AI",
      "level": "regional",
      "exported": true,
      "sources": ["fictional-gazette"]
    },
    {
      "place": "AL",
      "level": "regional",
      "exported": true,
      "sources": ["fictional-gazette"]
    },
    {
      "place": "AM",
      "level": "regional",
      "exported": true,
      "sources": ["fictional-gazette"]
    },
    {
      "place": "AO",
      "level": "regional",
      "exported": true,
      "sources": ["fictional-gazette"]
    },
    {
      "place": "AQ",
      "level": "regional",
      "exported": true,
      "sources": ["fictional-gazette"]
    },
    {
      "place": "AR",
      "level": "regional",
      "exported": true,
      "sources": ["fictional-gazette"]
    },
    {
      "place": "AS",
      "level": "regional",
      "exported": true,
      "sources": ["fictional-gazette"]
    },
    {
      "place": "AT",
      "level": "regional",
      "exported": true,
      "sources": ["fictional-gazette"]
    },
    {
      "place": "AU",
      "level": "regional",
      "exported": true,
      "sources": ["fictional-gazette"]
    },
    {
      "place": "AW",
      "level": "regional",
      "exported": true,
      "sources": ["fictional-gazette"]
    },
    {
      "place": "AX",
      "level": "regional",
      "exported": true,
      "sources": ["fictional-gazette"]
    },
    {
      "place": "AZ",
      "level": "regional",
      "exported": true,
      "sources": ["fictional-gazette"]
    },
    {
      "place": "BA",
      "level": "regional",
      "exported": true,
      "sources": ["fictional-gazette"]
    },
    {
      "place": "BB",
      "level": "regional",
      "exported": true,
      "sources": ["fictional-gazette"]
    },
    {
      "place": "BD",
      "level": "regional",
      "exported": true,
      "sources": ["fictional-gazette"]
    },
    {
      "place": "BE",
      "level": "regional",
      "exported": true,
      "sources": ["fictional-gazette"]
    },
    {
      "place": "BF",
      "level": "regional",
      "exported": true,
      "sources": ["fictional-gazette"]
    },
    {
      "place": "BG",
      "level": "regional",
      "exported": true,
      "sources": ["fictional-gazette"]
    },
    {
      "place": "BH",
      "level": "regional",
      "exported": true,
      "sources": ["fictional-gazette"]
    },
    {
      "place": "BI",
      "level": "regional",
      "exported": true,
      "sources": ["fictional-gazette"]
    },
    {
      "place": "BJ",
      "level": "regional",
      "exported": true,
      "sources": ["fictional-gazette"]
    },
    {
      "place": "BL",
      "level": "regional",
      "exported": true,
      "sources": ["fictional-gazette"]
    },
    {
      "place": "BM",
      "level": "regional",
      "exported": true,
      "sources": ["fictional-gazette"]
    },
    {
      "place": "BN",
      "level": "regional",
      "exported": true,
      "sources": ["fictional-gazette"]
    },
    {
      "place": "BO",
      "level": "regional",
      "exported": true,
      "sources": ["fictional-gazette"]
    },
    {
      "place": "BQ",
      "level": "regional",
      "exported": true,
      "sources": ["fictional-gazette"]
    }
  ],
  "intensity": {
    "value": 4,
    "sources": ["fictional-census"]
  },
  "awareness": {
    "value": 4,
    "sources": [],
    "editorial": true
  },
  "sources": [
    {
      "id": "fictional-census",
      "type": "dataset",
      "title": "Censo Imaginário de Coisas Brasileiras 2025",
      "publisher": "Instituto Brasileiro de Geografia Imaginária",
      "url": "https://example.org/fictional-census",
      "published": "2025",
      "accessed": "2026-09-25",
      "language": "pt"
    },
    {
      "id": "fictional-gazette",
      "type": "news",
      "title": "Brazilians Surprised Again",
      "publisher": "The Example Gazette",
      "url": "https://example.org/fictional-gazette",
      "published": "2026-01-15",
      "accessed": "2026-09-25",
      "language": "en"
    }
  ],
  "image": {
    "file": "cover.webp",
    "credit": {
      "author": "Índice Jabuticaba (imagem fictícia)",
      "license": "CC0-1.0"
    }
  }
}
