{
  "$schema": "../../../schemas/item.schema.json",
  "id": "jeitinho",
  "status": "mock",
  "methodologyVersion": "0.1",
  "lastReviewed": "2026-09-25",
  "category": "culture",
  "presence": [
    {
      "place": "IT",
      "level": "regional",
      "sources": [],
      "editorial": true
    },
    {
      "place": "AR",
      "level": "regional",
      "sources": [],
      "editorial": true
    },
    {
      "place": "IN",
      "level": "regional",
      "sources": [],
      "editorial": true
    },
    {
      "place": "RU",
      "level": "regional",
      "sources": [],
      "editorial": true
    },
    {
      "place": "NG",
      "level": "regional",
      "sources": [],
      "editorial": true
    }
  ],
  "intensity": {
    "value": {
      "min": 1,
      "max": 3
    },
    "sources": [],
    "editorial": true
  },
  "awareness": {
    "value": 4,
    "sources": [],
    "editorial": true
  },
  "sources": [
    {
      "id": "fictional-forum",
      "type": "other",
      "title": "Tópico: isso só existe aqui?",
      "publisher": "Fórum Imaginário",
      "url": "https://example.org/fictional-forum",
      "accessed": "2026-09-25",
      "language": "pt"
    }
  ]
}
